{
  "id": "arkham_007",
  "name": "Underground Tunnels",
  "description": "Dark, damp tunnels run beneath Arkham. The air is thick with the smell of earth and something else... something ancient.",
  "zone": "arkham",
  "exits": {
    "north": null,
    "south": null,
    "east": null,
    "west": null,
    "up": "arkham_001",
    "down": null
  },
  "field1": null,
  "field2": null,
  "field3": null
}
