{
  "id": "arkham_001",
  "name": "Arkham Town Square",
  "description": "You are standing in the bustling heart of Arkham. The Miskatonic River flows nearby.",
  "zone": "arkham",
  "exits": {
    "north": "arkham_002",
    "south": "arkham_003",
    "east": "arkham_004",
    "west": "arkham_005"
  },
  "field1": null,
  "field2": null,
  "field3": null
}
